{
  "registry_version": "0.1.0",
  "schema_version": "1.0.0",
  "registry_id": "capability-registry",
  "registry_type": "capability",
  "name": "Capability Registry",
  "scope": "Reusable capabilities admitted under an approved OS Ecosystem boundary.",
  "status": "active",
  "owner_layer": "Ultra Brain",
  "repository": "https://github.com/CSY8515/Ultra-Brain.git",
  "created_date": "2026-07-31",
  "updated_date": "2026-07-31",
  "entities": []
}
