{
  "registry_version": "0.1.0",
  "schema_version": "1.0.0",
  "registry_id": "meta-os-registry",
  "registry_type": "meta_os",
  "name": "Meta OS Registry",
  "scope": "Canonical identities and v0.1 scope definitions for the five Core Meta OS domains.",
  "status": "active",
  "owner_layer": "Ultra Brain",
  "repository": "https://github.com/CSY8515/Ultra-Brain.git",
  "created_date": "2026-07-31",
  "updated_date": "2026-08-03",
  "entities": [
    {
      "id": "safety-core-meta-os",
      "entity_type": "meta_os",
      "name": "Safety Core Meta OS",
      "scope": "Validation, integrity, monitoring, risk, safety logging, audit, backup, recovery, execution-safety, and incident-management authority.",
      "status": "active",
      "owner_layer": "Meta OS",
      "parent": "ultra-brain",
      "repository": "https://github.com/CSY8515/Ultra-Brain.git",
      "path": "Safety-Core-Meta-OS",
      "interface": [
        "safety-core-control-interface"
      ],
      "contract": [
        "safety-core-control-contract"
      ],
      "current_version": "0.2.0",
      "created_date": "2026-07-31",
      "updated_date": "2026-08-01"
    },
    {
      "id": "enhancement-core-meta-os",
      "entity_type": "meta_os",
      "name": "Enhancement Core Meta OS",
      "scope": "Analytics, bounded learning, pattern analysis, knowledge candidates, transparent optimization, draft rule generation, prediction, insight, and advisory decision-support authority.",
      "status": "active",
      "owner_layer": "Meta OS",
      "parent": "ultra-brain",
      "repository": "https://github.com/CSY8515/Ultra-Brain.git",
      "path": "Enhancement-Core-Meta-OS",
      "interface": [
        "enhancement-core-analysis-interface"
      ],
      "contract": [
        "enhancement-core-analysis-contract"
      ],
      "current_version": "0.3.0",
      "created_date": "2026-07-31",
      "updated_date": "2026-08-01"
    },
    {
      "id": "automation-core-meta-os",
      "entity_type": "meta_os",
      "name": "Automation Core Meta OS",
      "scope": "Controlled workflow, trigger, scheduling, routine, pipeline, batch, registered local automatic execution, typed automatic decision, and local notification authority.",
      "status": "active",
      "owner_layer": "Meta OS",
      "parent": "ultra-brain",
      "repository": "https://github.com/CSY8515/Ultra-Brain.git",
      "path": "Automation-Core-Meta-OS",
      "interface": [
        "automation-core-execution-interface"
      ],
      "contract": [
        "automation-core-execution-contract"
      ],
      "current_version": "0.4.0",
      "created_date": "2026-07-31",
      "updated_date": "2026-08-01"
    },
    {
      "id": "collaboration-connectivity-core-meta-os",
      "entity_type": "meta_os",
      "name": "Collaboration & Connectivity Core Meta OS",
      "scope": "Governed API management, caller-resolved credentials, connectors, import/export, synchronization, cross-platform exchange, repository, external-AI, communication, and ecosystem-connectivity authority.",
      "status": "active",
      "owner_layer": "Meta OS",
      "parent": "ultra-brain",
      "repository": "https://github.com/CSY8515/Ultra-Brain.git",
      "path": "Collaboration-Connectivity-Core-Meta-OS",
      "interface": [
        "collaboration-connectivity-core-exchange-interface"
      ],
      "contract": [
        "collaboration-connectivity-core-exchange-contract"
      ],
      "current_version": "0.5.0",
      "created_date": "2026-07-31",
      "updated_date": "2026-08-01"
    },
    {
      "id": "personal-secretary-core-meta-os",
      "entity_type": "meta_os",
      "name": "Personal Secretary Core Meta OS",
      "scope": "Consent-aware daily briefing, weekly and monthly review, reminder, recommendation, priority, advisory decision-support, personal assistance, context-support, and scheduling-proposal authority.",
      "status": "active",
      "owner_layer": "Meta OS",
      "parent": "ultra-brain",
      "repository": "https://github.com/CSY8515/Ultra-Brain.git",
      "path": "Personal-Secretary-Core-Meta-OS",
      "interface": [
        "personal-secretary-core-assistance-interface",
        "personal-secretary-operational-reporting-interface"
      ],
      "contract": [
        "personal-secretary-core-assistance-contract",
        "personal-secretary-operational-reporting-contract"
      ],
      "current_version": "0.61.0",
      "created_date": "2026-07-31",
      "updated_date": "2026-08-03"
    }
  ]
}
