{
  "registry_version": "0.1.0",
  "schema_version": "1.0.0",
  "registry_id": "interface-registry",
  "registry_type": "interface",
  "name": "Interface Registry",
  "scope": "Approved and versioned interaction boundaries published by governed entities.",
  "status": "active",
  "owner_layer": "Ultra Brain",
  "repository": "https://github.com/CSY8515/Ultra-Brain.git",
  "created_date": "2026-07-31",
  "updated_date": "2026-08-05",
  "entities": [
    {
      "id": "safety-core-control-interface",
      "entity_type": "interface",
      "name": "Safety Core Control Interface",
      "scope": "Local v0.2 interface for safety evaluation, evidence verification, backup, recovery, monitoring, and incident controls.",
      "status": "active",
      "owner_layer": "Meta OS",
      "parent": "safety-core-meta-os",
      "repository": "https://github.com/CSY8515/Ultra-Brain.git",
      "path": "Safety-Core-Meta-OS/interfaces/safety_core.interface.json",
      "interface": [],
      "contract": [
        "safety-core-control-contract"
      ],
      "current_version": "0.2.0",
      "created_date": "2026-08-01",
      "updated_date": "2026-08-01"
    },
    {
      "id": "enhancement-core-analysis-interface",
      "entity_type": "interface",
      "name": "Enhancement Core Analysis Interface",
      "scope": "Local v0.3 interface for evidence-bounded analytics, learning, patterns, knowledge candidates, optimization, draft rules, prediction, insight, and advisory decision support.",
      "status": "active",
      "owner_layer": "Meta OS",
      "parent": "enhancement-core-meta-os",
      "repository": "https://github.com/CSY8515/Ultra-Brain.git",
      "path": "Enhancement-Core-Meta-OS/interfaces/enhancement_core.interface.json",
      "interface": [],
      "contract": [
        "enhancement-core-analysis-contract"
      ],
      "current_version": "0.3.0",
      "created_date": "2026-08-01",
      "updated_date": "2026-08-01"
    },
    {
      "id": "automation-core-execution-interface",
      "entity_type": "interface",
      "name": "Automation Core Execution Interface",
      "scope": "Local v0.4 interface for authorized workflows, triggers, schedules, routines, typed decisions, pipelines, batches, registered action execution, and local notifications.",
      "status": "active",
      "owner_layer": "Meta OS",
      "parent": "automation-core-meta-os",
      "repository": "https://github.com/CSY8515/Ultra-Brain.git",
      "path": "Automation-Core-Meta-OS/interfaces/automation_core.interface.json",
      "interface": [],
      "contract": [
        "automation-core-execution-contract"
      ],
      "current_version": "0.4.0",
      "created_date": "2026-08-01",
      "updated_date": "2026-08-01"
    },
    {
      "id": "collaboration-connectivity-core-exchange-interface",
      "entity_type": "interface",
      "name": "Collaboration & Connectivity Core Exchange Interface",
      "scope": "Local v0.5 interface for governed connectors, API budgets, credential references, data portability, synchronization, external AI, repositories, communication, and ecosystem exchange.",
      "status": "active",
      "owner_layer": "Meta OS",
      "parent": "collaboration-connectivity-core-meta-os",
      "repository": "https://github.com/CSY8515/Ultra-Brain.git",
      "path": "Collaboration-Connectivity-Core-Meta-OS/interfaces/connectivity_core.interface.json",
      "interface": [],
      "contract": [
        "collaboration-connectivity-core-exchange-contract"
      ],
      "current_version": "0.5.0",
      "created_date": "2026-08-01",
      "updated_date": "2026-08-01"
    },
    {
      "id": "personal-secretary-core-assistance-interface",
      "entity_type": "interface",
      "name": "Personal Secretary Core Assistance Interface",
      "scope": "Local v0.6 interface for consent-aware briefings, reviews, reminders, recommendations, priorities, decision support, assistance, context support, and scheduling proposals.",
      "status": "active",
      "owner_layer": "Meta OS",
      "parent": "personal-secretary-core-meta-os",
      "repository": "https://github.com/CSY8515/Ultra-Brain.git",
      "path": "Personal-Secretary-Core-Meta-OS/interfaces/personal_secretary_core.interface.json",
      "interface": [],
      "contract": [
        "personal-secretary-core-assistance-contract"
      ],
      "current_version": "0.6.0",
      "created_date": "2026-08-01",
      "updated_date": "2026-08-01"
    },
    {
      "id": "personal-secretary-operational-reporting-interface",
      "entity_type": "interface",
      "name": "Personal Secretary Operational Reporting Interface",
      "scope": "v0.61 architecture port for registered Ultra Brain, Core Meta OS, Registry, Validation, Release, OS Ecosystem, project, and database operational summaries.",
      "status": "active",
      "owner_layer": "Meta OS",
      "parent": "personal-secretary-core-meta-os",
      "repository": "https://github.com/CSY8515/Ultra-Brain.git",
      "path": "Personal-Secretary-Core-Meta-OS/interfaces/operational_reporting.interface.json",
      "interface": [],
      "contract": [
        "personal-secretary-operational-reporting-contract"
      ],
      "current_version": "0.61.0",
      "created_date": "2026-08-03",
      "updated_date": "2026-08-03"
    },
    {
      "id": "ultra-brain-os-ecosystem-management-interface",
      "entity_type": "interface",
      "name": "Ultra Brain OS Ecosystem Management Interface",
      "scope": "Declarative v0.7 boundary for OS Ecosystem v0.73 identity, lifecycle, release health, dependency compatibility, operational reporting, and structural navigation.",
      "status": "active",
      "owner_layer": "Ultra Brain",
      "parent": "os-ecosystem",
      "repository": "https://github.com/CSY8515/Ultra-Brain.git",
      "path": "interfaces/os_ecosystem.interface.json",
      "interface": [],
      "contract": ["ultra-brain-os-ecosystem-management-contract"],
      "current_version": "0.7.0",
      "created_date": "2026-08-04",
      "updated_date": "2026-08-04"
    },
    {
      "id": "ultra-brain-ui-system-interface",
      "entity_type": "interface",
      "name": "Ultra Brain Official UI System Interface",
      "scope": "v0.92 boundary for registry-driven Theme Packages, bounded detail adjustments, live preview, hierarchy propagation, affected-scope reporting, locks, OS Ecosystem forwarding, and rollback references.",
      "status": "active",
      "owner_layer": "Ultra Brain",
      "parent": "ultra-brain",
      "repository": "https://github.com/CSY8515/Ultra-Brain.git",
      "path": "interfaces/ui_system.interface.json",
      "interface": [],
      "contract": ["ultra-brain-ui-system-contract"],
      "current_version": "0.92.0",
      "created_date": "2026-08-05",
      "updated_date": "2026-08-06"
    }
  ]
}
