{
  "registry_version": "0.1.0",
  "schema_version": "1.0.0",
  "registry_id": "contract-registry",
  "registry_type": "contract",
  "name": "Contract Registry",
  "scope": "Approved and versioned behavioral obligations between governed entities.",
  "status": "active",
  "owner_layer": "Ultra Brain",
  "repository": "https://github.com/CSY8515/Ultra-Brain.git",
  "created_date": "2026-07-31",
  "updated_date": "2026-08-04",
  "entities": [
    {
      "id": "safety-core-control-contract",
      "entity_type": "contract",
      "name": "Safety Core Control Contract",
      "scope": "Versioned v0.2 obligations and fail-closed failure semantics between Safety Core Meta OS and governed callers.",
      "status": "active",
      "owner_layer": "Meta OS",
      "parent": "safety-core-meta-os",
      "repository": "https://github.com/CSY8515/Ultra-Brain.git",
      "path": "Safety-Core-Meta-OS/contracts/safety_core.contract.json",
      "interface": [
        "safety-core-control-interface"
      ],
      "contract": [],
      "current_version": "0.2.0",
      "created_date": "2026-08-01",
      "updated_date": "2026-08-01"
    },
    {
      "id": "enhancement-core-analysis-contract",
      "entity_type": "contract",
      "name": "Enhancement Core Analysis Contract",
      "scope": "Versioned v0.3 obligations for provenance, confidence, candidate status, advisory decisions, bounded input, and non-execution.",
      "status": "active",
      "owner_layer": "Meta OS",
      "parent": "enhancement-core-meta-os",
      "repository": "https://github.com/CSY8515/Ultra-Brain.git",
      "path": "Enhancement-Core-Meta-OS/contracts/enhancement_core.contract.json",
      "interface": [
        "enhancement-core-analysis-interface"
      ],
      "contract": [],
      "current_version": "0.3.0",
      "created_date": "2026-08-01",
      "updated_date": "2026-08-01"
    },
    {
      "id": "automation-core-execution-contract",
      "entity_type": "contract",
      "name": "Automation Core Execution Contract",
      "scope": "Versioned v0.4 obligations for explicit authorization, bounded local execution, idempotency, retry, compensation, audit, and notification containment.",
      "status": "active",
      "owner_layer": "Meta OS",
      "parent": "automation-core-meta-os",
      "repository": "https://github.com/CSY8515/Ultra-Brain.git",
      "path": "Automation-Core-Meta-OS/contracts/automation_core.contract.json",
      "interface": [
        "automation-core-execution-interface"
      ],
      "contract": [],
      "current_version": "0.4.0",
      "created_date": "2026-08-01",
      "updated_date": "2026-08-01"
    },
    {
      "id": "collaboration-connectivity-core-exchange-contract",
      "entity_type": "contract",
      "name": "Collaboration & Connectivity Core Exchange Contract",
      "scope": "Versioned v0.5 obligations for explicit authorization, credential isolation, bounded exchange, deterministic synchronization, and external failure containment.",
      "status": "active",
      "owner_layer": "Meta OS",
      "parent": "collaboration-connectivity-core-meta-os",
      "repository": "https://github.com/CSY8515/Ultra-Brain.git",
      "path": "Collaboration-Connectivity-Core-Meta-OS/contracts/connectivity_core.contract.json",
      "interface": [
        "collaboration-connectivity-core-exchange-interface"
      ],
      "contract": [],
      "current_version": "0.5.0",
      "created_date": "2026-08-01",
      "updated_date": "2026-08-01"
    },
    {
      "id": "personal-secretary-core-assistance-contract",
      "entity_type": "contract",
      "name": "Personal Secretary Core Assistance Contract",
      "scope": "Versioned v0.6 obligations for consent grants, bounded caller data, provenance, advisory outputs, privacy, and non-execution.",
      "status": "active",
      "owner_layer": "Meta OS",
      "parent": "personal-secretary-core-meta-os",
      "repository": "https://github.com/CSY8515/Ultra-Brain.git",
      "path": "Personal-Secretary-Core-Meta-OS/contracts/personal_secretary_core.contract.json",
      "interface": [
        "personal-secretary-core-assistance-interface"
      ],
      "contract": [],
      "current_version": "0.6.0",
      "created_date": "2026-08-01",
      "updated_date": "2026-08-01"
    },
    {
      "id": "personal-secretary-operational-reporting-contract",
      "entity_type": "contract",
      "name": "Personal Secretary Operational Reporting Contract",
      "scope": "v0.61 obligations for registered summary intake, evidence-linked briefs, approval boundaries, outcome reports, and failure/recovery/rollback support.",
      "status": "active",
      "owner_layer": "Meta OS",
      "parent": "personal-secretary-core-meta-os",
      "repository": "https://github.com/CSY8515/Ultra-Brain.git",
      "path": "Personal-Secretary-Core-Meta-OS/contracts/operational_reporting.contract.json",
      "interface": [
        "personal-secretary-operational-reporting-interface"
      ],
      "contract": [],
      "current_version": "0.61.0",
      "created_date": "2026-08-03",
      "updated_date": "2026-08-03"
    },
    {
      "id": "ultra-brain-os-ecosystem-management-contract",
      "entity_type": "contract",
      "name": "Ultra Brain OS Ecosystem Management Contract",
      "scope": "v0.7 obligations for independent OS Ecosystem management, dependency compatibility, operational-report flow, advisory authority, navigation structure, and ownership preservation.",
      "status": "active",
      "owner_layer": "Ultra Brain",
      "parent": "os-ecosystem",
      "repository": "https://github.com/CSY8515/Ultra-Brain.git",
      "path": "contracts/os_ecosystem.contract.json",
      "interface": ["ultra-brain-os-ecosystem-management-interface"],
      "contract": [],
      "current_version": "0.7.0",
      "created_date": "2026-08-04",
      "updated_date": "2026-08-04"
    }
  ]
}
