{
  "registry_version": "0.1.0",
  "schema_version": "1.0.0",
  "registry_id": "rule-registry",
  "registry_type": "rule",
  "name": "Rule Registry",
  "scope": "Enforceable Ultra Brain rule-set baselines.",
  "status": "active",
  "owner_layer": "Ultra Brain",
  "repository": "https://github.com/CSY8515/Ultra-Brain.git",
  "created_date": "2026-07-31",
  "updated_date": "2026-07-31",
  "entities": [
    {
      "id": "ultra-brain-foundation-rules",
      "entity_type": "rule_set",
      "name": "Ultra Brain Foundation Rules",
      "scope": "Mandatory v0.1 authority, scope, safety, boundary, change, validation, and release rules.",
      "status": "active",
      "owner_layer": "Ultra Brain",
      "parent": "ultra-brain",
      "repository": "https://github.com/CSY8515/Ultra-Brain.git",
      "path": "RULES.md",
      "interface": [],
      "contract": [],
      "current_version": "0.1.0",
      "created_date": "2026-07-31",
      "updated_date": "2026-07-31"
    }
  ]
}
