{
  "registry_version": "0.1.0",
  "schema_version": "1.0.0",
  "registry_id": "standard-registry",
  "registry_type": "standard",
  "name": "Standard Registry",
  "scope": "Ultra Brain conformance and quality baselines.",
  "status": "active",
  "owner_layer": "Ultra Brain",
  "repository": "https://github.com/CSY8515/Ultra-Brain.git",
  "created_date": "2026-07-31",
  "updated_date": "2026-07-31",
  "entities": [
    {
      "id": "ultra-brain-foundation-standards",
      "entity_type": "standard_set",
      "name": "Ultra Brain Foundation Standards",
      "scope": "v0.1 documentation, naming, registry, schema, interface, contract, validation, and release standards.",
      "status": "active",
      "owner_layer": "Ultra Brain",
      "parent": "ultra-brain",
      "repository": "https://github.com/CSY8515/Ultra-Brain.git",
      "path": "STANDARDS.md",
      "interface": [],
      "contract": [],
      "current_version": "0.1.0",
      "created_date": "2026-07-31",
      "updated_date": "2026-07-31"
    }
  ]
}
